{
  "schemaVersion": 1,
  "benchmarkVersion": "2",
  "scenarioId": "documentation-correction",
  "description": "Narrow documentation correction with no executable behavior or sensitive content.",
  "input": {
    "workType": "documentation",
    "surfaces": [],
    "risks": [],
    "platforms": []
  },
  "expectedProfile": "light",
  "measurements": {
    "direct": { "inputTokens": null, "outputTokens": null, "cacheReadTokens": null, "cacheWriteTokens": null, "totalTokens": null, "wallClockMs": null, "verification": "NOT_AVAILABLE" },
    "forgeloopBalanced": { "inputTokens": null, "outputTokens": null, "cacheReadTokens": null, "cacheWriteTokens": null, "totalTokens": null, "wallClockMs": null, "verification": "NOT_AVAILABLE" },
    "forgeloopAdaptive": { "inputTokens": null, "outputTokens": null, "cacheReadTokens": null, "cacheWriteTokens": null, "totalTokens": null, "wallClockMs": null, "verification": "NOT_AVAILABLE" }
  }
}
