{
  "schemaVersion": 1,
  "benchmarkVersion": "1",
  "scenarioId": "authentication-change",
  "description": "Authentication behavior change crossing a trust boundary.",
  "input": {
    "workType": "api-auth",
    "surfaces": ["auth", "api"],
    "risks": [],
    "platforms": ["server"]
  },
  "expectedProfile": "full",
  "measurements": {
    "direct": { "inputTokens": null, "outputTokens": null, "cacheReadTokens": null, "cacheWriteTokens": null, "totalTokens": null, "wallClockMs": null, "verification": "NOT_AVAILABLE" },
    "forgeloopBalanced": { "inputTokens": null, "outputTokens": null, "cacheReadTokens": null, "cacheWriteTokens": null, "totalTokens": null, "wallClockMs": null, "verification": "NOT_AVAILABLE" },
    "forgeloopAdaptive": { "inputTokens": null, "outputTokens": null, "cacheReadTokens": null, "cacheWriteTokens": null, "totalTokens": null, "wallClockMs": null, "verification": "NOT_AVAILABLE" }
  }
}
